[
  {
    "id": "srd-5.2:rule/ability-check",
    "name": "Ability Check",
    "category": "definition",
    "description": "An ability check is a D20 Test that represents using one of the six abilities—or a specific skill associated with an ability—to overcome a challenge. *See also* “Playing the Game” (“D20 Tests” and “Proficiency”).",
    "seeAlso": [
      "srd-5.2:rule/proficiency"
    ]
  },
  {
    "id": "srd-5.2:rule/ability-score-and-modifier",
    "name": "Ability Score and Modifier",
    "category": "definition",
    "description": "A creature has six ability scores—Strength, Dexterity, Constitution, Intelligence, Wisdom, and Charisma—each of which has a corresponding modifier. Add the modifier when you make a D20 Test with the corresponding ability or when a rule asks you to do so. *See also* “Playing the Game” (“The Six Abilities”)."
  },
  {
    "id": "srd-5.2:rule/action",
    "name": "Action",
    "category": "definition",
    "description": "On your turn, you can take one action. Choose which action to take from those below or from the special actions provided by your features. *See also* “Playing the Game” (“Actions”). These actions are defined elsewhere in this glossary:\n\n| Attack | Dodge | Influence | Search |\n|---|---|---|---|\n| Dash | Help | Magic | Study |\n| Disengage | Hide | Ready | Utilize |"
  },
  {
    "id": "srd-5.2:rule/advantage",
    "name": "Advantage",
    "category": "definition",
    "description": "If you have Advantage on a D20 Test, roll two d20s, and use the higher roll. A roll can’t be affected by more than one Advantage, and Advantage and Disadvantage on the same roll cancel each other. *See* *also* “Playing the Game” (“D20 Tests”)."
  },
  {
    "id": "srd-5.2:rule/adventure",
    "name": "Adventure",
    "category": "definition",
    "description": "An adventure is a series of encounters. A story emerges through playing them. *See also* “Encounter.”",
    "seeAlso": [
      "srd-5.2:rule/encounter"
    ]
  },
  {
    "id": "srd-5.2:rule/alignment",
    "name": "Alignment",
    "category": "definition",
    "description": "A creature’s alignment broadly describes its ethical attitudes and ideals. Alignment is a combination of two factors: one identifies morality (good, evil, or neutral), and the other describes attitudes toward order (lawful, chaotic, or neutral). These factors allow for nine possible combinations, such as Lawful Good and Neutral Evil. *See also* “Character Creation” (“Create Your Character”)."
  },
  {
    "id": "srd-5.2:rule/ally",
    "name": "Ally",
    "category": "definition",
    "description": "A creature is your ally if it is a member of your adventuring party, your friend, on your side in combat, or a creature that the rules or the GM designates as your ally."
  },
  {
    "id": "srd-5.2:rule/area-of-effect",
    "name": "Area of Effect",
    "category": "definition",
    "description": "The descriptions of many spells and other features specify that they have an area of effect, which typically has one of six shapes. These shapes are defined elsewhere in this glossary:\n\n| Cone | Cylinder | Line |\n|---|---|---|\n| Cube | Emanation | Sphere |\n\nAn area of effect has a point of origin, a location from which the effect’s energy erupts. The rules for each shape specify how to position its point of origin. If all straight lines extending from the point of origin to a location in the area of effect are blocked, that location isn’t included in the area of effect. To block a line, an obstruction must provide Total Cover. *See also* “Cover.”\n\nIf the creator of an area of effect places it at an unseen point and an obstruction—such as a wall— is between the creator and that point, the point of origin comes into being on the near side of the obstruction.",
    "seeAlso": [
      "srd-5.2:rule/cover"
    ]
  },
  {
    "id": "srd-5.2:rule/armor-class",
    "name": "Armor Class",
    "category": "definition",
    "description": "An Armor Class (AC) is the target number for an attack roll. AC represents how difficult it is to hit a target.\n\nYour base AC calculation is 10 plus your Dexterity modifier. If a rule gives you another base AC calculation, you choose which calculation to use; you can’t use more than one. *See also* “Attack Roll.”",
    "seeAlso": [
      "srd-5.2:rule/attack-roll"
    ]
  },
  {
    "id": "srd-5.2:rule/armor-training",
    "name": "Armor Training",
    "category": "definition",
    "description": "Armor training allows you to use armor of a certain category without the following drawbacks. If you wear Light, Medium, or Heavy armor and lack training with it, you have Disadvantage on any D20 Test that involves Strength or Dexterity, and you can’t cast spells. If you use a Shield and lack training with it, you don’t gain its AC bonus. *See also* “Disadvantage” and “Equipment” (“Armor”).",
    "seeAlso": [
      "srd-5.2:rule/disadvantage"
    ]
  },
  {
    "id": "srd-5.2:rule/attack",
    "name": "Attack",
    "category": "action",
    "description": "When you take the Attack action, you can make one attack roll with a weapon or an Unarmed Strike.\n\n**Equipping and Unequipping Weapons.** You can either equip or unequip one weapon when you make an attack as part of this action. You do so either before or after the attack. If you equip a weapon before an attack, you don’t need to use it for that attack. Equipping a weapon includes drawing it from a sheath or picking it up. Unequipping a weapon includes sheathing, stowing, or dropping it.\n\n**Moving between Attacks.** If you move on your turn and have a feature, such as Extra Attack, that gives you more than one attack as part of the Attack action, you can use some or all of that movement to move between those attacks.",
    "term": "attack"
  },
  {
    "id": "srd-5.2:rule/attack-roll",
    "name": "Attack Roll",
    "category": "definition",
    "description": "An attack roll is a D20 Test that represents making an attack with a weapon, an Unarmed Strike, or a spell. *See also* “Playing the Game” (“D20 Tests”)."
  },
  {
    "id": "srd-5.2:rule/attitude",
    "name": "Attitude",
    "category": "definition",
    "description": "A monster has a starting attitude toward a player character: Friendly, Hostile, or Indifferent. *See also* “Friendly,” “Hostile,” “Indifferent,” and “Influence.”",
    "seeAlso": [
      "srd-5.2:rule/friendly",
      "srd-5.2:rule/hostile",
      "srd-5.2:rule/indifferent",
      "srd-5.2:rule/influence"
    ]
  },
  {
    "id": "srd-5.2:rule/attunement",
    "name": "Attunement",
    "category": "definition",
    "description": "Some magic items require a creature to form a bond—called Attunement—with them before the creature can use an item’s magical properties. A creature can have Attunement with no more than three magic items at a time. *See also* “Equipment” (“Magic Items”)."
  },
  {
    "id": "srd-5.2:rule/blindsight",
    "name": "Blindsight",
    "category": "definition",
    "description": "If you have Blindsight, you can see within a specific range without relying on physical sight. Within that range, you can see anything that isn’t behind Total Cover even if you have the Blinded condition or are in Darkness. Moreover, in that range, you can see something that has the Invisible condition."
  },
  {
    "id": "srd-5.2:rule/bloodied",
    "name": "Bloodied",
    "category": "definition",
    "description": "A creature is Bloodied while it has half its Hit Points or fewer remaining."
  },
  {
    "id": "srd-5.2:rule/bonus-action",
    "name": "Bonus Action",
    "category": "definition",
    "description": "A Bonus Action is a special action that you can take on the same turn that you take an action. You can’t take more than one Bonus Action on a turn, and you have a Bonus Action to take only if a rule explicitly says so. *See also* “Playing the Game” (“Actions”)."
  },
  {
    "id": "srd-5.2:rule/breaking-objects",
    "name": "Breaking Objects",
    "category": "definition",
    "description": "Objects can be harmed by attacks and by some spells, using the rules below. If an object is exceedingly fragile, the GM may allow a creature to break it automatically with the Attack or Utilize action.\n\n**Armor Class.** The Object Armor Class table suggests ACs for various substances.\n\n**Object Armor Class**\n\n| AC | Substance | AC | Substance |\n|---|---|---|---|\n| 11 | Cloth, paper, rope | 19 | Iron, steel |\n| 13 | Crystal, glass, ice | 21 | Mithral |\n| 15 | Wood | 23 | Adamantine |\n| 17 | Stone |  |  |\n\n**Hit Points.** An object is destroyed when it has 0 Hit Points. The Object Hit Points table suggests Hit Points for fragile and resilient objects that are Large or smaller. To track Hit Points for a Huge or Gargantuan object, divide it into Large or smaller sections, and track each section’s Hit Points separately. The GM determines whether destroying part of an object causes the whole thing to collapse.\n\n**Object Hit Points**\n\n| Size | Fragile | Resilient |\n|---|---|---|\n| Tiny (bottle, lock) | 2 (1d4) | 5 (2d4) |\n| Small (chest, lute) | 3 (1d6) | 10 (3d6) |\n| Medium (barrel, chandelier) | 4 (1d8) | 18 (4d8) |\n| Large (cart, dining table) | 5 (1d10) | 27 (5d10) |\n\n**Damage Types and Objects.** Objects have Immunity to Poison and Psychic damage. The GM might decide that some damage types are more or less effective against an object. For example, Bludgeoning damage works well for smashing things but not for cutting. Paper or cloth objects might have Vulnerability to Fire damage.\n\n**Damage Threshold.** Big objects, such as castle walls, often have extra resilience represented by a damage threshold. *See also* “Damage Threshold.”\n\n**No Ability Scores.** An object lacks ability scores unless a rule assigns scores to the object. Without ability scores, an object can’t make ability checks, and it fails all saving throws.",
    "seeAlso": [
      "srd-5.2:rule/damage-threshold"
    ]
  },
  {